Title,Link,PublishedDate
Azure Service Fabric 9.0 Tenth Refresh Release,https://azure.microsoft.com/en-us/updates/azure-service-fabric-90-tenth-refresh-release/,"Thu, 06 Jul 2023 00:00:09 Z"
Azure Service Fabric 9.1 Fifth Refresh Release,https://azure.microsoft.com/en-us/updates/azure-service-fabric-91-fifth-refresh-release/,"Thu, 06 Jul 2023 00:00:08 Z"
Public preview: Azure Virtual Network encryption,https://azure.microsoft.com/en-us/updates/public-preview-azure-virtual-network-encryption-2/,"Thu, 06 Jul 2023 16:00:17 Z"
Azure SQL—General availability updates for early July 2023,https://azure.microsoft.com/en-us/updates/azure-sql-general-availability-updates-for-early-july-2023/,"Mon, 10 Jul 2023 23:07:02 Z"
Azure Managed Lustre now generally available,https://azure.microsoft.com/en-us/updates/azure-managed-lustre-now-generally-available/,"Mon, 10 Jul 2023 16:55:56 Z"
Generally available: Azure Digital Twins supports Digital Twins Definition Language version 3,https://azure.microsoft.com/en-us/updates/generally-available-azure-digital-twins-supports-digital-twins-definition-language-version-3/,"Mon, 10 Jul 2023 16:00:16 Z"
Azure’s cross-region Load Balancer is now generally available,https://azure.microsoft.com/en-us/updates/azure-s-crossregion-load-balancer-is-now-generally-available/,"Mon, 10 Jul 2023 16:00:14 Z"
"General availability: Azure Data Explorer adds support for PostgreSQL, MySQL, and CosmosDB SQL external tables",https://azure.microsoft.com/en-us/updates/adx-external-tables/,"Mon, 10 Jul 2023 15:00:14 Z"
