Title,Link,PublishedDate
How to estimate pricing for WordPress on App Service,https://techcommunity.microsoft.com/t5/apps-on-azure-blog/how-to-estimate-pricing-for-wordpress-on-app-service/ba-p/4029262,"Sun, 14 Jan 2024 11:58:05 PST"
Kudu Dashboard explained - WordPress on App Service,https://techcommunity.microsoft.com/t5/apps-on-azure-blog/kudu-dashboard-explained-wordpress-on-app-service/ba-p/4030035,"Mon, 15 Jan 2024 12:25:36 PST"
Azure Spring Apps feature updates in Q4 2023,https://techcommunity.microsoft.com/t5/apps-on-azure-blog/azure-spring-apps-feature-updates-in-q4-2023/ba-p/4029618,"Mon, 15 Jan 2024 03:22:10 PST"
"With geo-replica, Web PubSub resources are fault tolerant and can communicate across regions",https://techcommunity.microsoft.com/t5/apps-on-azure-blog/with-geo-replica-web-pubsub-resources-are-fault-tolerant-and-can/ba-p/4029482,"Sun, 14 Jan 2024 23:40:24 PST"
Deploy apps to Azure Container Apps easily with .NET Aspire,https://techcommunity.microsoft.com/t5/apps-on-azure-blog/deploy-apps-to-azure-container-apps-easily-with-net-aspire/ba-p/4032711,"Wed, 17 Jan 2024 14:08:36 PST"
