Title,Link,PublishedDate
Generally available: Azure Data Explorer Kusto Emulator on Linux,https://azure.microsoft.com/en-us/updates/kusto-emulator-linux/,"Mon, 05 Jun 2023 17:00:01 Z"
Public Preview: Azure Chaos Studio is now available in West US 2 region,https://azure.microsoft.com/en-us/updates/public-preview-azure-chaos-studio-is-now-available-in-west-us-2-region/,"Mon, 05 Jun 2023 16:00:00 Z"
Public Preview: Azure AD Support for Azure Files SMB shares REST API,https://azure.microsoft.com/en-us/updates/azure-files-rest-oauth/,"Tue, 06 Jun 2023 16:01:13 Z"
Generally available: Private Link support for Application Gateway,https://azure.microsoft.com/en-us/updates/generally-available-application-gateway-private-link/,"Tue, 06 Jun 2023 16:01:05 Z"
Generally available: Multiple backups per day for Azure Virtual Machines,https://azure.microsoft.com/en-us/updates/multiple-backups-per-day/,"Tue, 06 Jun 2023 16:00:53 Z"
General availability: New KQL function to enrich your data analysis with geographic context,https://azure.microsoft.com/en-us/updates/geo-ip/,"Tue, 06 Jun 2023 16:00:41 Z"
Public preview: Azure Container Instances(ACI) Spot containers,https://azure.microsoft.com/en-us/updates/public-preview-azure-container-instancesaci-spot-containers/,"Wed, 07 Jun 2023 17:00:09 Z"
