Title,Link,PublishedDate
Azure Container Apps Newsletter – July 2023,https://techcommunity.microsoft.com/t5/apps-on-azure-blog/azure-container-apps-newsletter-july-2023/ba-p/3888121,"Mon, 31 Jul 2023 17:15:06 PDT"
GitHub Copilot for Azure API Management Policies,https://techcommunity.microsoft.com/t5/apps-on-azure-blog/github-copilot-for-azure-api-management-policies/ba-p/3884229,"Mon, 31 Jul 2023 01:00:00 PDT"
Announcing the Reliable Web App Pattern for Java,https://techcommunity.microsoft.com/t5/apps-on-azure-blog/announcing-the-reliable-web-app-pattern-for-java/ba-p/3879661,"Tue, 1 Aug 2023 07:59:00 PDT"
Not able to delete files from the Kudu Console on an App Service,https://techcommunity.microsoft.com/t5/apps-on-azure-blog/not-able-to-delete-files-from-the-kudu-console-on-an-app-service/ba-p/3871032,"Wed, 2 Aug 2023 03:17:08 PDT"
"Use User managed identity to replace connection string in""AzureWebJobsStorage"" for function apps",https://techcommunity.microsoft.com/t5/apps-on-azure-blog/use-user-managed-identity-to-replace-connection-string-in-quot/ba-p/3891026,"Thu, 3 Aug 2023 20:26:14 PDT"
Email support with WordPress on Azure AppService,https://techcommunity.microsoft.com/t5/apps-on-azure-blog/email-support-with-wordpress-on-azure-appservice/ba-p/3890486,"Thu, 3 Aug 2023 08:21:57 PDT"
