Title,Link,PublishedDate
ISC 2023: Experience the power of HPC in the cloud with Microsoft Azure,https://azure.microsoft.com/blog/isc-2023-experience-the-power-of-hpc-in-the-cloud-with-microsoft-azure/,"Mon, 01 May 2023 08:00:02 Z"
Azure Virtual WAN introduces its first SaaS offering,https://azure.microsoft.com/blog/azure-virtual-wan-introduces-its-first-saas-offering/,"Tue, 02 May 2023 09:00:17 Z"
"Secure your cloud environment with Cloud Next-Generation Firewall by Palo Alto Networks, an Azure Native ISV Service—now in preview",https://azure.microsoft.com/blog/secure-your-cloud-environment-with-cloud-nextgeneration-firewall-by-palo-alto-networks-an-azure-native-isv-service-now-in-pre/,"Tue, 02 May 2023 08:00:16 Z"
Microsoft Cost Management updates—April 2023,https://azure.microsoft.com/blog/microsoft-cost-management-updates-april-2023/,"Wed, 03 May 2023 09:00:04 Z"
Preparing for future health emergencies with Azure HPC,https://azure.microsoft.com/blog/preparing-for-future-health-emergencies-with-azure-hpc/,"Wed, 03 May 2023 08:00:31 Z"
