Title,Link,PublishedDate
Generally available: Indirect enterprise agreement on Azure Cost Management and Billing,https://azure.microsoft.com/en-us/updates/indirect-billing-experience-on-cost-management-and-billing/,"Tue, 24 Jan 2023 18:00:11 Z"
General availability: Application security groups support for private endpoints,https://azure.microsoft.com/en-us/updates/general-availability-application-security-groups-support-for-private-endpoints/,"Tue, 24 Jan 2023 17:00:12 Z"
General availability: Mount Azure Storage as a local share in App Service Windows Code,https://azure.microsoft.com/en-us/updates/general-availability-mount-azure-storage-as-a-local-share-in-app-service-windows-code/,"Tue, 24 Jan 2023 17:00:11 Z"
Public preview: Incremental snapshots for Ultra Disk Storage,https://azure.microsoft.com/en-us/updates/public-preview-incremental-snapshots-for-ultra-disk-storage/,"Wed, 25 Jan 2023 18:00:03 Z"
General Availability: 5 GB Put Blob,https://azure.microsoft.com/en-us/updates/general-availability-5-gib-put-blob/,"Tue, 24 Jan 2023 17:00:00 Z"
