Title,Link,PublishedDate
Your ultimate guide to Azure app innovation at Microsoft Build 2023,https://techcommunity.microsoft.com/t5/apps-on-azure-blog/your-ultimate-guide-to-azure-app-innovation-at-microsoft-build/ba-p/3824723,"Thu, 18 May 2023 15:32:08 PDT"
Azure Spring Apps feature updates in FY23 Q3,https://techcommunity.microsoft.com/t5/apps-on-azure-blog/azure-spring-apps-feature-updates-in-fy23-q3/ba-p/3827257,"Mon, 22 May 2023 08:29:40 PDT"
Announcing: Contoso Real Estate JavaScript Composable Application Reference Sample,https://techcommunity.microsoft.com/t5/apps-on-azure-blog/announcing-contoso-real-estate-javascript-composable-application/ba-p/3827097,"Mon, 22 May 2023 08:05:20 PDT"
Run JBoss EAP on Azure Red Hat OpenShift,https://techcommunity.microsoft.com/t5/apps-on-azure-blog/run-jboss-eap-on-azure-red-hat-openshift/ba-p/3812097,"Mon, 22 May 2023 08:00:00 PDT"
Automatically run and monitor performance tests in Azure Load Testing,https://techcommunity.microsoft.com/t5/apps-on-azure-blog/automatically-run-and-monitor-performance-tests-in-azure-load/ba-p/3827088,"Mon, 22 May 2023 06:23:59 PDT"
