Title,Link,PublishedDate
How to detect Java dependency version conflict using IDEA Maven Helper,https://techcommunity.microsoft.com/t5/apps-on-azure-blog/how-to-detect-java-dependency-version-conflict-using-idea-maven/ba-p/3915091,"Thu, 31 Aug 2023 18:34:15 PDT"
Diagnose performance bottlenecks of your web app with Azure Load Testing,https://techcommunity.microsoft.com/t5/apps-on-azure-blog/diagnose-performance-bottlenecks-of-your-web-app-with-azure-load/ba-p/3913615,"Thu, 31 Aug 2023 00:03:51 PDT"
Application gateway for Containers vs Application Gateway Ingress Controller - What's changed?,https://techcommunity.microsoft.com/t5/apps-on-azure-blog/application-gateway-for-containers-vs-application-gateway/ba-p/3914901,"Fri, 1 Sep 2023 06:35:19 PDT"
Azure Container Apps Newsletter – August 2023,https://techcommunity.microsoft.com/t5/apps-on-azure-blog/azure-container-apps-newsletter-august-2023/ba-p/3916409,"Fri, 1 Sep 2023 23:14:28 PDT"
Troubleshooting guide for Application Configuration Service on Azure Spring Apps,https://techcommunity.microsoft.com/t5/apps-on-azure-blog/troubleshooting-guide-for-application-configuration-service-on/ba-p/3909442,"Mon, 4 Sep 2023 19:52:53 PDT"
Announcing Public Preview of Free Hosting Plan for WordPress on App Service,https://techcommunity.microsoft.com/t5/apps-on-azure-blog/announcing-public-preview-of-free-hosting-plan-for-wordpress-on/ba-p/3918254,"Tue, 5 Sep 2023 02:02:00 PDT"
