Title,Link,PublishedDate
General availability: Apache log4J2 sink to Azure Data Explorer,https://azure.microsoft.com/en-us/updates/general-availability-apache-log4j2-sink-to-azure-data-explorer/,"Thu, 05 Jan 2023 18:00:05 Z"
General Availability: Azure Sphere support for European Data Boundary,https://azure.microsoft.com/en-us/updates/general-availability-azure-sphere-support-for-european-data-boundary/,"Thu, 05 Jan 2023 17:00:05 Z"
At-scale monitoring for Azure Site Recovery with Backup center,https://azure.microsoft.com/en-us/updates/atscale-monitoring-for-azure-site-recovery-with-backup-center/,"Mon, 09 Jan 2023 18:00:08 Z"
Public Preview:  Azure Cosmos DB to Azure Data Explorer Synapse Link,https://azure.microsoft.com/en-us/updates/cosmos-db-adx-synapse-link-public-preview/,"Mon, 09 Jan 2023 17:00:09 Z"
Public preview: Capture Event Hubs data with Stream Analytics no-code editor in Delta Lake format,https://azure.microsoft.com/en-us/updates/public-preview-capture-event-hubs-data-with-stream-analytics-nocode-editor-in-delta-lake-format/,"Mon, 09 Jan 2023 17:00:09 Z"
"Azure VM backup: General availability updates for Dec, 2022",https://azure.microsoft.com/en-us/updates/azure-vm-backup-fixing-a-known-issue-with-sql-vms/,"Mon, 09 Jan 2023 17:00:08 Z"
Generally Available: Azure Red Hat OpenShift in Brazil Southeast,https://azure.microsoft.com/en-us/updates/generally-available-azure-red-hat-openshift-in-brazil-southeast/,"Mon, 09 Jan 2023 17:00:07 Z"
