Title,Link,PublishedDate
Istio-based service mesh add-on for Azure Kubernetes Service - Preview,https://techcommunity.microsoft.com/t5/apps-on-azure-blog/istio-based-service-mesh-add-on-for-azure-kubernetes-service/ba-p/3800229,"Wed, 19 Apr 2023 08:25:15 PDT"
Azure Kubernetes upgrades and Long Term Support,https://techcommunity.microsoft.com/t5/apps-on-azure-blog/azure-kubernetes-upgrades-and-long-term-support/ba-p/3782789,"Tue, 18 Apr 2023 00:46:46 PDT"
Azure Resource Graph Explorer for Microsoft.Web resources,https://techcommunity.microsoft.com/t5/apps-on-azure-blog/azure-resource-graph-explorer-for-microsoft-web-resources/ba-p/3798295,"Mon, 17 Apr 2023 23:48:32 PDT"
General Availability for Azure Active Directory (AD) Workload Identity on AKS,https://techcommunity.microsoft.com/t5/apps-on-azure-blog/general-availability-for-azure-active-directory-ad-workload/ba-p/3798292,"Mon, 17 Apr 2023 23:39:51 PDT"
Leverage OpenCost on Azure Kubernetes Service to understand and monitor your infrastructure spend,https://techcommunity.microsoft.com/t5/apps-on-azure-blog/leverage-opencost-on-azure-kubernetes-service-to-understand-and/ba-p/3796813,"Mon, 17 Apr 2023 23:00:00 PDT"
Create and bind the custom domain contains special Unicode character in App Service Using Azure CLI,https://techcommunity.microsoft.com/t5/apps-on-azure-blog/create-and-bind-the-custom-domain-contains-special-unicode/ba-p/3797564,"Mon, 17 Apr 2023 22:04:35 PDT"
Enabling AppServiceAppLogs & AppServiceHTTPLogs diagnostic settings in app services,https://techcommunity.microsoft.com/t5/apps-on-azure-blog/enabling-appserviceapplogs-amp-appservicehttplogs-diagnostic/ba-p/3793845,"Mon, 17 Apr 2023 06:58:05 PDT"
Deploy app service with private endpoint enabled via Azure DevOps,https://techcommunity.microsoft.com/t5/apps-on-azure-blog/deploy-app-service-with-private-endpoint-enabled-via-azure/ba-p/3789370,"Sun, 16 Apr 2023 22:47:26 PDT"
Storing App Service application logs in Blob,https://techcommunity.microsoft.com/t5/apps-on-azure-blog/storing-app-service-application-logs-in-blob/ba-p/3800963,"Thu, 20 Apr 2023 02:32:39 PDT"
