Title,Link,PublishedDate
General Availability : Help API provides access to self-help diagnostics,https://azure.microsoft.com/en-us/updates/general-availability-help-api-provides-access-to-selfhelp-diagnostics/,"Mon, 14 Aug 2023 19:00:38 Z"
Public Preview: Azure Backup now supports Cross Region Restore for PostgreSQL backups,https://azure.microsoft.com/en-us/updates/public-preview-azure-backup-now-supports-cross-region-restore-for-postgresql-backups/,"Mon, 14 Aug 2023 18:00:37 Z"
Public preview: New Monitoring and Logging Updates in Azure Firewall,https://azure.microsoft.com/en-us/updates/new-monitoring-and-logging-updates-in-azure-firewall/,"Mon, 14 Aug 2023 16:00:37 Z"
General availability: New Monitoring and Logging Updates in Azure Firewall,https://azure.microsoft.com/en-us/updates/general-availability-new-monitoring-and-logging-updates-in-azure-firewall/,"Mon, 14 Aug 2023 16:00:37 Z"
Azure Sphere (Integrated) Public Preview,https://azure.microsoft.com/en-us/updates/azure-sphere-integrated-public-preview/,"Mon, 14 Aug 2023 16:00:36 Z"
Public Preview: Azure NetApp Files Cloud Backup for Virtual Machines,https://azure.microsoft.com/en-us/updates/public-preview-azure-netapp-files-cloud-backup-for-virtual-machines/,"Tue, 15 Aug 2023 16:00:51 Z"
Generally available: Azure Load Testing in Japan East and Brazil South,https://azure.microsoft.com/en-us/updates/generally-available-azure-load-testing-in-japan-east-and-brazil-south/,"Tue, 15 Aug 2023 16:00:50 Z"
Public preview: Azure Mv3 Medium Memory (MM) Virtual Machines,https://azure.microsoft.com/en-us/updates/public-preview-azure-mv3-medium-memory-virtual-machines/,"Tue, 15 Aug 2023 15:00:50 Z"
