Title,Link,PublishedDate
Azure PowerShell Functions - connect SFTP and Storage Account,https://techcommunity.microsoft.com/t5/apps-on-azure-blog/azure-powershell-functions-connect-sftp-and-storage-account/ba-p/3898637,"Thu, 17 Aug 2023 00:49:50 PDT"
Maximizing Value: Streamlined Cloud Solutions with Prime Cost Savings for Spring Apps – upto 47% off,https://techcommunity.microsoft.com/t5/apps-on-azure-blog/maximizing-value-streamlined-cloud-solutions-with-prime-cost/ba-p/3904599,"Mon, 21 Aug 2023 09:00:00 PDT"
Build Right and Fast: Landing Zone Accelerator for Spring Apps - Now Generally Available!,https://techcommunity.microsoft.com/t5/apps-on-azure-blog/build-right-and-fast-landing-zone-accelerator-for-spring-apps/ba-p/3903517,"Mon, 21 Aug 2023 09:00:00 PDT"
Introducing Microsoft Playwright Testing private preview,https://techcommunity.microsoft.com/t5/apps-on-azure-blog/introducing-microsoft-playwright-testing-private-preview/ba-p/3905705,"Tue, 22 Aug 2023 08:01:13 PDT"
How to remove the PHP X-Powered-By header from HTTP response for PHP 8.x apps on Linux App Service,https://techcommunity.microsoft.com/t5/apps-on-azure-blog/how-to-remove-the-php-x-powered-by-header-from-http-response-for/ba-p/3905880,"Tue, 22 Aug 2023 02:37:50 PDT"
