Title,Link,PublishedDate
Azure Functions Newsletter – May 2023,https://techcommunity.microsoft.com/t5/apps-on-azure-blog/azure-functions-newsletter-may-2023/ba-p/3821780,"Mon, 15 May 2023 11:10:13 PDT"
Microsoft and VMware Take Center Stage at Spring I/O 2023 in Barcelona!,https://techcommunity.microsoft.com/t5/apps-on-azure-blog/microsoft-and-vmware-take-center-stage-at-spring-i-o-2023-in/ba-p/3819550,"Tue, 16 May 2023 07:58:00 PDT"
What's new for Java on Azure at Build 2023,https://techcommunity.microsoft.com/t5/apps-on-azure-blog/what-s-new-for-java-on-azure-at-build-2023/ba-p/3818419,"Tue, 16 May 2023 07:58:00 PDT"
Securing your AKS Deployments - Microservice User Authentication using Azure AD and Oauth 2 Proxy,https://techcommunity.microsoft.com/t5/apps-on-azure-blog/securing-your-aks-deployments-microservice-user-authentication/ba-p/3823867,"Wed, 17 May 2023 12:55:44 PDT"
Securing your AKS deployments - SSL Termination on NGINX ILB using Front Door and Private Link,https://techcommunity.microsoft.com/t5/apps-on-azure-blog/securing-your-aks-deployments-ssl-termination-on-nginx-ilb-using/ba-p/3823910,"Wed, 17 May 2023 12:23:26 PDT"
