Title,Link,PublishedDate
Read-write premium caching now in public preview,https://azure.microsoft.com/en-us/updates/readwrite-premium-caching-now-in-public-preview/,"Mon, 20 Feb 2023 17:00:22 Z"
Public Preview: Azure NetApp Files support for 2TiB capacity pools,https://azure.microsoft.com/en-us/updates/public-preview-azure-netapp-files-support-for-2tib-capacity-pools/,"Tue, 21 Feb 2023 22:00:13 Z"
General availability: Azure IoT Edge supports Ubuntu 22.04,https://azure.microsoft.com/en-us/updates/general-availability-azure-iot-edge-supports-ubuntu-2204/,"Tue, 21 Feb 2023 18:00:09 Z"
Now Available: Azure Monitor Query client module for Go,https://azure.microsoft.com/en-us/updates/azure-monitor-query-go/,"Tue, 21 Feb 2023 18:00:08 Z"
General availability: Azure Data Explorer Dashboards,https://azure.microsoft.com/en-us/updates/adxdashboards/,"Tue, 21 Feb 2023 18:00:08 Z"
Public Preview: Customer-managed keys for Azure NetApp Files volume encryption,https://azure.microsoft.com/en-us/updates/public-preview-data-encryption-at-rest-of-azure-netapp-files-volumes-with-customermanaged-keys-2/,"Tue, 21 Feb 2023 18:00:07 Z"
Public preview: New General-Purpose VMs - Dlsv5 and Dldsv5,https://azure.microsoft.com/en-us/updates/public-preview-new-generalpurpose-vms-dlsv5-and-dldsv5/,"Mon, 20 Feb 2023 18:00:22 Z"
