Title,Link,PublishedDate
Microsoft and Rockwell Automation collaborate on digital solutions for manufacturers,https://azure.microsoft.com/blog/microsoft-and-rockwell-automation-collaborate-on-digital-solutions-for-manufacturers/,"Thu, 23 Feb 2023 09:00:04 Z"
Farming from space: How orbital data is unlocking novel agriculture insights,https://azure.microsoft.com/blog/farming-from-space-how-orbital-data-is-unlocking-novel-agriculture-insights/,"Thu, 23 Feb 2023 08:00:04 Z"
3 Microsoft Azure AI product features that accelerate language learning,https://azure.microsoft.com/blog/3-microsoft-azure-ai-product-features-that-accelerate-language-learning/,"Fri, 24 Feb 2023 08:00:18 Z"
Microsoft Azure innovation powers leading price-performance for SQL Server,https://azure.microsoft.com/blog/microsoft-azure-innovation-powers-leading-priceperformance-for-sql-server/,"Thu, 23 Feb 2023 10:00:05 Z"
Azure private MEC delivers modern connected applications for industries,https://azure.microsoft.com/blog/azure-private-mec-delivers-modern-connected-applications-for-industries/,"Sun, 26 Feb 2023 15:00:11 Z"
Empowering operators and enterprises with the next wave of Azure for Operators services shaping the future of cloud,https://azure.microsoft.com/blog/empowering-operators-and-enterprises-with-the-next-wave-of-azure-for-operators-services-shaping-the-future-of-cloud/,"Sun, 26 Feb 2023 15:00:11 Z"
Agile teams align and get to market faster with Mural and Microsoft,https://azure.microsoft.com/blog/agile-teams-align-and-get-to-market-faster-with-mural-and-microsoft/,"Mon, 27 Feb 2023 10:00:01 Z"
What's new in Azure Data & AI: Azure is the best place to build and run AI workloads,https://azure.microsoft.com/blog/whats-new-in-azure-data-ai-azure-is-best-place-to-build-and-run-ai-workloads/,"Mon, 27 Feb 2023 09:00:20 Z"
Microsoft commercial marketplace: empowering customized experiences to drive innovation,https://azure.microsoft.com/blog/microsoft-commercial-marketplace-empowering-customized-experiences-to-drive-innovation/,"Mon, 27 Feb 2023 08:00:20 Z"
