Title,Link,PublishedDate
Update records in a Kusto Database (public preview),https://azure.microsoft.com/en-us/updates/update-kusto-db/,"Tue, 20 Feb 2024 20:00:22 Z"
Public Preview: Regional Disaster Recovery by Azure Backup for AKS,https://azure.microsoft.com/en-us/updates/public-preview-regional-disaster-recovery-by-azure-backup-for-aks/,"Tue, 20 Feb 2024 20:00:22 Z"
Public preview: Configuration-as-code customizations in Microsoft Dev Box,https://azure.microsoft.com/en-us/updates/public-preview-configascode-customizations-in-microsoft-dev-box/,"Tue, 20 Feb 2024 18:00:21 Z"
Sending a log search alert with cross tenant target resource will no longer be supported,https://azure.microsoft.com/en-us/updates/sending-a-log-search-alert-with-cross-tenant-target-resource-will-no-longer-be-supported/,"Wed, 21 Feb 2024 21:11:28 Z"
General Availability: Azure NetApp Files Standard Network Features - Edit Volumes,https://azure.microsoft.com/en-us/updates/general-availability-edit-network-features-for-azure-netapp-files/,"Tue, 20 Feb 2024 18:00:21 Z"
Public Preview: Azure Storage Actions — Serverless storage data management,https://azure.microsoft.com/en-us/updates/azure-storage-actions-preview/,"Tue, 20 Feb 2024 16:29:27 Z"
