Title,Link,PublishedDate
Support has ended for Gen 4 hardware on Azure SQL Database,https://azure.microsoft.com/en-us/updates/support-has-ended-for-gen-4-hardware-on-azure-sql-database/,"Fri, 21 Apr 2023 23:00:06 Z"
"Cognitive Services Custom Commands feature is being retired on April 30, 2026",https://azure.microsoft.com/en-us/updates/retirement-notice-custom-commands-will-retire-on-30-april-2026/,"Fri, 21 Apr 2023 23:00:06 Z"
App Service Environment version 1 and version 2 will be retired on 31 August 2024,https://azure.microsoft.com/en-us/updates/app-service-environment-v1-v2-retirement/,"Fri, 21 Apr 2023 23:00:05 Z"
Azure Service Fabric 9.1 Third Refresh Release,https://azure.microsoft.com/en-us/updates/azure-service-fabric-91-third-refresh-release-2/,"Mon, 24 Apr 2023 18:00:05 Z"
Generally available: Cross-region service endpoints for Azure Storage,https://azure.microsoft.com/en-us/updates/generally-available-crossregion-service-endpoints-for-azure-storage/,"Mon, 24 Apr 2023 18:00:04 Z"
Preview: Introducing DCesv5 and ECesv5-series Confidential VMs with Intel TDX,https://azure.microsoft.com/en-us/updates/confidential-vms-with-intel-tdx-dcesv5-ecesv5/,"Mon, 24 Apr 2023 17:00:04 Z"
