Title,Link,PublishedDate
Min TLS Cipher Suite (Preview) Now Available on Azure Portal and Info on Upcoming Changes Before GA,https://techcommunity.microsoft.com/t5/apps-on-azure-blog/min-tls-cipher-suite-preview-now-available-on-azure-portal-and/ba-p/3804134,"Mon, 24 Apr 2023 13:38:36 PDT"
Start Your Cloud Journey with Azure App Service,https://techcommunity.microsoft.com/t5/apps-on-azure-blog/start-your-cloud-journey-with-azure-app-service/ba-p/3804037,"Mon, 24 Apr 2023 12:32:18 PDT"
Give us your thoughts on running Kubernetes anywhere for a chance to win a $300 USD gift card!,https://techcommunity.microsoft.com/t5/apps-on-azure-blog/give-us-your-thoughts-on-running-kubernetes-anywhere-for-a/ba-p/3797779,"Tue, 25 Apr 2023 09:00:00 PDT"
Bring Your Own Storage (BYOS) to Azure App Service Web App,https://techcommunity.microsoft.com/t5/apps-on-azure-blog/bring-your-own-storage-byos-to-azure-app-service-web-app/ba-p/3753649,"Tue, 25 Apr 2023 02:15:29 PDT"
App Service does not support Server Push in Http2,https://techcommunity.microsoft.com/t5/apps-on-azure-blog/app-service-does-not-support-server-push-in-http2/ba-p/3803424,"Mon, 24 Apr 2023 23:18:07 PDT"
A month of cloud native: Explore resources for cloud native app development,https://techcommunity.microsoft.com/t5/apps-on-azure-blog/a-month-of-cloud-native-explore-resources-for-cloud-native-app/ba-p/3741548,"Wed, 26 Apr 2023 13:34:26 PDT"
Web App Performance Root Cause Analysis with Application Insights,https://techcommunity.microsoft.com/t5/apps-on-azure-blog/web-app-performance-root-cause-analysis-with-application/ba-p/3805931,"Wed, 26 Apr 2023 10:14:02 PDT"
Azure Load Testing Pricing,https://techcommunity.microsoft.com/t5/apps-on-azure-blog/azure-load-testing-pricing/ba-p/3805812,"Wed, 26 Apr 2023 08:56:52 PDT"
How To List All VNET Subnets Used for Private Endpoints of App service using PowerShell Script,https://techcommunity.microsoft.com/t5/apps-on-azure-blog/how-to-list-all-vnet-subnets-used-for-private-endpoints-of-app/ba-p/3806513,"Thu, 27 Apr 2023 19:14:15 PDT"
"Java Spring Boot, MongoDB Atlas App on Azure App Service",https://techcommunity.microsoft.com/t5/apps-on-azure-blog/java-spring-boot-mongodb-atlas-app-on-azure-app-service/ba-p/3804121,"Thu, 27 Apr 2023 09:00:00 PDT"
Configuring Custom DNS for Azure Spring App in a Private Network,https://techcommunity.microsoft.com/t5/apps-on-azure-blog/configuring-custom-dns-for-azure-spring-app-in-a-private-network/ba-p/3805406,"Wed, 26 Apr 2023 22:59:32 PDT"
