Title,Link,PublishedDate
Connect Azure Stream Analytics to Azure Data Explorer using managed private endpoint.,https://azure.microsoft.com/en-us/updates/asa-azuredataexplorer-managed-private-endpoint/,"Thu, 13 Apr 2023 16:00:16 Z"
Use Stream Analytics to process exported data from Application Insights,https://azure.microsoft.com/en-us/updates/asa-applicationinsight/,"Thu, 13 Apr 2023 16:00:16 Z"
Retirement notice: transition to the Authentication methods policy for Azure Active Directory,https://azure.microsoft.com/en-us/updates/retirement-notice-transition-to-the-authentication-methods-policy-for-azure-active-directory/,"Fri, 14 Apr 2023 23:00:11 Z"
Regional expansion: Azure Elastic SAN Public Preview is now available in more regions.,https://azure.microsoft.com/en-us/updates/regional-expansion-azure-elastic-san-public-preview-is-now-available-in-more-regions/,"Mon, 17 Apr 2023 17:00:18 Z"
General Availability: Azure CNI Overlay,https://azure.microsoft.com/en-us/updates/azurecnioverlay/,"Mon, 17 Apr 2023 15:00:17 Z"
Generally Available:  Azure App Service - New Premium v3 Offerings,https://azure.microsoft.com/en-us/updates/generally-available-azure-app-service-new-premium-v3-offerings/,"Tue, 18 Apr 2023 15:00:36 Z"
Public Preview: Isovalent Cilium Enterprise through Azure Marketplace,https://azure.microsoft.com/en-us/updates/ciliumenterpriseonazuremarketplace/,"Tue, 18 Apr 2023 15:00:19 Z"
