Title,Link,PublishedDate
Public preview: Optimize your workloads for reliability using new workbook template in Azure Advisor,https://azure.microsoft.com/en-us/updates/public-preview-optimize-your-workloads-for-reliability-using-new-workbook-template-in-azure-advisor/,"Tue, 16 May 2023 19:17:28 Z"
General availability: Seamlessly upgrade your Application Gateway V2 WAF configuration to a policy,https://azure.microsoft.com/en-us/updates/general-availability-application-gateway-v2-config-to-policy-upgrade-experience/,"Tue, 16 May 2023 19:00:01 Z"
App Service now supports Custom Error pages in public preview,https://azure.microsoft.com/en-us/updates/customerrorpages/,"Tue, 16 May 2023 17:00:51 Z"
Public preview: Rolling Upgrades with MaxSurge for Virtual Machine Scale Sets,https://azure.microsoft.com/en-us/updates/rollingupgradeswithmaxsurge/,"Wed, 17 May 2023 21:00:06 Z"
Generally available: Azure Site Recovery update rollup 67 - May 2023,https://azure.microsoft.com/en-us/updates/generally-available-azure-site-recovery-update-rollup-67-may-2023/,"Wed, 17 May 2023 17:00:05 Z"
General availability: Azure Data Explorer adds new geospatial capabilities,https://azure.microsoft.com/en-us/updates/azure-data-explorer-adds-new-geospatial-capabilities-buffer/,"Wed, 17 May 2023 17:00:04 Z"
General Availability: Routing Intent and Virtual WAN Integrated Firewall NVAs,https://azure.microsoft.com/en-us/updates/general-availability-routing-intent-and-virtual-wan-integrated-firewall-nvas/,"Wed, 17 May 2023 16:00:05 Z"
Azure Backup Reports now includes support for more workloads,https://azure.microsoft.com/en-us/updates/azure-backup-reports-now-includes-support-for-more-workloads/,"Wed, 17 May 2023 16:00:03 Z"
Public Preview: Azure NetApp Files Standard Network Features - Edit Volumes,https://azure.microsoft.com/en-us/updates/public-preview-azure-netapp-files-edit-network-features/,"Thu, 18 May 2023 17:00:11 Z"
