Title,Link,PublishedDate
General Availability: ASP. NET web app migration to Azure App Service using PowerShell Scripts,https://azure.microsoft.com/en-us/updates/general-availability-asp-net-web-app-migration-to-azure-app-service-using-powershell-scripts/,"Mon, 20 Mar 2023 17:47:40 Z"
Azure Maps is now HIPAA (Health Insurance Portability and Accountability Act) compliant,https://azure.microsoft.com/en-us/updates/azure-maps-is-now-hipaa-health-insurance-portability-and-accountability-act-compliant/,"Mon, 20 Mar 2023 17:00:10 Z"
Generally available: Encryption scopes on hierarchical namespace enabled storage accounts,https://azure.microsoft.com/en-us/updates/generally-available-encryption-scopes-on-hierarchical-namespace-enabled-storage-accounts/,"Mon, 20 Mar 2023 17:00:10 Z"
General availability: Serilog Sink for Azure Data Explorer,https://azure.microsoft.com/en-us/updates/general-availability-serilog-sink-for-azure-data-explorer/,"Mon, 20 Mar 2023 17:00:09 Z"
Announcement: Azure Active Directory backed authentication for JMS 2.0 API on Azure Service Bus,https://azure.microsoft.com/en-us/updates/announcment-azure-active-directory-backed-authentication-for-jms-20-api-on-azure-service-bus/,"Tue, 21 Mar 2023 17:00:03 Z"
Public preview: Azure Maps Creator – Improved indoor maps onboarding and new Features API,https://azure.microsoft.com/en-us/updates/public-preview-azure-maps-creator-improved-indoor-maps-onboarding-and-new-features-api/,"Wed, 22 Mar 2023 17:00:05 Z"
General availability: Azure Virtual Network Manager,https://azure.microsoft.com/en-us/updates/general-availability-azure-virtual-network-manager-3/,"Wed, 22 Mar 2023 16:00:15 Z"
General availability: Reserved namespaces for subdomains,https://azure.microsoft.com/en-us/updates/general-availability-reserved-namespaces-for-subdomains/,"Wed, 22 Mar 2023 16:00:04 Z"
