Title,Link,PublishedDate
Announcing Tomcat support in Azure Container Apps,https://techcommunity.microsoft.com/t5/apps-on-azure-blog/announcing-tomcat-support-in-azure-container-apps/ba-p/4074465,"Sun, 3 Mar 2024 22:52:50 PST"
Azure Container Apps Newsletter – March 2024,https://techcommunity.microsoft.com/t5/apps-on-azure-blog/azure-container-apps-newsletter-march-2024/ba-p/4076252,"Tue, 5 Mar 2024 07:38:06 PST"
Improved Next.js support (Preview) for Azure Static Web Apps,https://techcommunity.microsoft.com/t5/apps-on-azure-blog/improved-next-js-support-preview-for-azure-static-web-apps/ba-p/4078617,"Thu, 7 Mar 2024 09:16:56 PST"
"March 2024: Exploring open source at Microsoft, and other highlights for developers",https://techcommunity.microsoft.com/t5/apps-on-azure-blog/march-2024-exploring-open-source-at-microsoft-and-other/ba-p/4080165,"Fri, 8 Mar 2024 14:38:47 PST"
Tick-tock! Upgrade your App Service Environment before time runs out,https://techcommunity.microsoft.com/t5/apps-on-azure-blog/tick-tock-upgrade-your-app-service-environment-before-time-runs/ba-p/4079782,"Fri, 8 Mar 2024 08:38:33 PST"
