Title,Link,PublishedDate
Automate your load tests with CI/CD in just a few clicks,https://techcommunity.microsoft.com/t5/apps-on-azure-blog/automate-your-load-tests-with-ci-cd-in-just-a-few-clicks/ba-p/3931185,"Tue, 19 Sep 2023 05:33:05 PDT"
It's time to 🍂 #FallForIntelligentApps 🍂,https://techcommunity.microsoft.com/t5/apps-on-azure-blog/it-s-time-to-fallforintelligentapps/ba-p/3931266,"Tue, 19 Sep 2023 00:21:54 PDT"
Init Containers in Azure Container Apps : Database Initialization,https://techcommunity.microsoft.com/t5/apps-on-azure-blog/init-containers-in-azure-container-apps-database-initialization/ba-p/3931271,"Wed, 20 Sep 2023 02:25:52 PDT"
Azure App Service Authentication: Using MSI or Service Principal to Call Another App Service,https://techcommunity.microsoft.com/t5/apps-on-azure-blog/azure-app-service-authentication-using-msi-or-service-principal/ba-p/3927161,"Fri, 22 Sep 2023 02:38:58 PDT"
Monitoring Azure Policy compliance across your Azure Managed Application deployments,https://techcommunity.microsoft.com/t5/apps-on-azure-blog/monitoring-azure-policy-compliance-across-your-azure-managed/ba-p/3922113,"Fri, 22 Sep 2023 02:16:48 PDT"
