Title,Link,PublishedDate
Public preview: Accelerated Connections for Network Virtual Appliances now in Azure Marketplace,https://azure.microsoft.com/en-us/updates/public-preview-accelerated-connections-for-network-virtual-appliances-now-in-azure-marketplace/,"Sat, 11 Mar 2023 02:52:24 Z"
Public preview: Illumio for Azure Firewall,https://azure.microsoft.com/en-us/updates/public-preview-illumio-for-azure-firewall/,"Mon, 13 Mar 2023 21:35:57 Z"
Generally available: Immutable vaults for Azure Backup,https://azure.microsoft.com/en-us/updates/azure-backup-immutable-vaults-ga/,"Mon, 13 Mar 2023 20:13:29 Z"
Public Preview: Azure Chaos Studio now available in,https://azure.microsoft.com/en-us/updates/public-preview-azure-chaos-studio-now-available-in/,"Mon, 13 Mar 2023 17:00:24 Z"
General availability: Ephemeral OS disks supports encryption at host using customer managed keys,https://azure.microsoft.com/en-us/updates/general-availability-ephemeral-os-disks-supports-hostbased-encryption-using-customer-managed-key/,"Mon, 13 Mar 2023 17:00:10 Z"
Public preview: Azure Cognitive Service for Vision Powers State-of-the-Art Computer Vision Development,https://azure.microsoft.com/en-us/updates/public-preview-azure-cognitive-service-for-vision-powers-stateoftheart-computer-vision-development/,"Tue, 14 Mar 2023 17:00:04 Z"
