Title,Link,PublishedDate
Generally available: Support for up to 100 TB of storage for the FHIR service,https://azure.microsoft.com/en-us/updates/support-for-up-to-100-tb-of-storage-for-the-fhir-service/,"Mon, 05 Feb 2024 18:52:22 Z"
Azure Ultra Disk Storage is now available in Canada East,https://azure.microsoft.com/en-us/updates/azure-ultra-disk-storage-is-now-available-in-canada-east/,"Mon, 05 Feb 2024 18:00:53 Z"
General availability: Topology,https://azure.microsoft.com/en-us/updates/general-availability-azure-topology/,"Mon, 05 Feb 2024 17:00:56 Z"
Mount Azure Storage as a local share in App Service Linux Now supports NFS,https://azure.microsoft.com/en-us/updates/mount-azure-storage-as-a-local-share-in-app-service-linux-now-supports-nfs/,"Mon, 05 Feb 2024 17:00:56 Z"
Announcing General Availability to migrate Virtual Network injected Azure Data Explorer Cluster to Private Endpoints,https://azure.microsoft.com/en-us/updates/adx-vnet-migration-ga/,"Mon, 05 Feb 2024 17:00:55 Z"
General Availability: Application consistent restore points supports Premium SSD v2 and Ultra Disks,https://azure.microsoft.com/en-us/updates/general-availability-application-consistent-restore-points-supports-premium-ssd-v2-and-ultra-disks/,"Tue, 06 Feb 2024 18:30:07 Z"
Public Preview: Azure NetApp Files Standard Network Features - Edit Volumes in US Gov Regions,https://azure.microsoft.com/en-us/updates/public-preview-azure-netapp-files-standard-network-features-edit-volumes-in-us-gov-regions/,"Tue, 06 Feb 2024 18:00:07 Z"
