Title,Link,PublishedDate
Cloud Services (classic) deployment model is retiring on 31 August 2024,https://azure.microsoft.com/en-us/updates/cloud-services-classic-retirement-announcement-feb2024/,"Sat, 02 Mar 2024 00:00:18 Z"
Public Preview: Well-Architected Framework assessment on Azure Advisor,https://azure.microsoft.com/en-us/updates/public-preview-wellarchitected-framework-assessment-on-azure-advisor/,"Mon, 04 Mar 2024 17:00:57 Z"
Public preview: Azure NetApp Files volume enhancement – allow the same file path for volumes in different availability zones,https://azure.microsoft.com/en-us/updates/public-preview-azure-netapp-files-volume-enhancement-allow-the-same-file-path-for-volumes-in-different-availability-zones/,"Tue, 05 Mar 2024 18:00:13 Z"
Public preview: New Generation AMD VMs - Dasv6/Easv6/Fasv6,https://azure.microsoft.com/en-us/updates/public-preview-new-generation-amd-vms-dav6eav6fav6-2/,"Tue, 05 Mar 2024 17:00:17 Z"
Azure Sphere OS version 24.03 is now available for evaluation,https://azure.microsoft.com/en-us/updates/azure-sphere-os-version-2403-is-now-available-for-evaluation/,"Tue, 05 Mar 2024 17:00:07 Z"
