Title,Link,PublishedDate
AI for Developers,https://techcommunity.microsoft.com/t5/apps-on-azure-blog/ai-for-developers/ba-p/4050809,"Tue, 6 Feb 2024 16:33:31 PST"
RECORDING TEST SCENARIOS IN JMETER,https://techcommunity.microsoft.com/t5/apps-on-azure-blog/recording-test-scenarios-in-jmeter/ba-p/4045051,"Tue, 6 Feb 2024 03:32:49 PST"
Simplifying Azure Kubernetes Service Authentication Part 1,https://techcommunity.microsoft.com/t5/apps-on-azure-blog/simplifying-azure-kubernetes-service-authentication-part-1/ba-p/4051439,"Wed, 7 Feb 2024 07:48:21 PST"
Creating Azure Container Apps using Azure Python SDK,https://techcommunity.microsoft.com/t5/apps-on-azure-blog/creating-azure-container-apps-using-azure-python-sdk/ba-p/4050894,"Thu, 8 Feb 2024 01:34:40 PST"
Using Azure Python SDK to manage Azure Container Apps - Part 1,https://techcommunity.microsoft.com/t5/apps-on-azure-blog/using-azure-python-sdk-to-manage-azure-container-apps-part-1/ba-p/4050894,"Thu, 8 Feb 2024 01:34:40 PST"
